Summary,Issue key,Issue id,Issue Type,Status,Project key,Project name,Project type,Project lead,Project lead id,Project description,Priority,Resolution,Assignee,Assignee Id,Reporter,Reporter Id,Creator,Creator Id,Created,Updated,Last Viewed,Resolved,Due date,Votes,Description,Environment,Watchers,Watchers Id,Original estimate,Remaining Estimate,Time Spent,Work Ratio,Σ Original Estimate,Σ Remaining Estimate,Σ Time Spent,Security Level,Custom field (Artifacts),Custom field (Compliance Requirement),Custom field (Control Link),Custom field (Development),Custom field (Issue color),Custom field (Link),Custom field (Q1 Actual Score),Custom field (Q1 Observations),Custom field (Q1 Target Score),Custom field (Q2 Actual Score),Custom field (Q2 Observations),Custom field (Q2 Target Score),Custom field (Q3 Actual Score),Custom field (Q3 Observations),Custom field (Q3 Target Score),Custom field (Q4 Actual Score),Custom field (Q4 Observations),Custom field (Q4 Target Score),Custom field (Rank),Custom field (Remediation Action Plan (Who will do What by When?) ),Custom field (Root Case),Custom field (Start date),Custom field (Team),Custom field (Test Procedures),Custom field (Testing Status),Custom field (Vulnerability),Status Category,Status Category Changed
Database failover not tested within past 12 months,FND-4,10350,Task,Not Started,FND,Findings,software,CPA to Cybersecurity,712020:aeb06967-d1d6-40ce-9026-14e256bca90d,,Medium,,,,CPA to Cybersecurity,712020:aeb06967-d1d6-40ce-9026-14e256bca90d,CPA to Cybersecurity,712020:aeb06967-d1d6-40ce-9026-14e256bca90d,11/Jan/26 3:22 PM,11/Jan/26 3:22 PM,,,,0,,,CPA to Cybersecurity,712020:aeb06967-d1d6-40ce-9026-14e256bca90d,,,,,,,,,,,,,,,,,,,,,,,,,,,0|i000q7:,,,,,,,,To Do,11/Jan/26 3:22 PM
CloudFront WAF integration not enabled; CDN provides availability but limited security filtering,FND-3,10349,Task,Not Started,FND,Findings,software,CPA to Cybersecurity,712020:aeb06967-d1d6-40ce-9026-14e256bca90d,,Medium,,,,CPA to Cybersecurity,712020:aeb06967-d1d6-40ce-9026-14e256bca90d,CPA to Cybersecurity,712020:aeb06967-d1d6-40ce-9026-14e256bca90d,11/Jan/26 3:22 PM,11/Jan/26 3:22 PM,,,,0,,,CPA to Cybersecurity,712020:aeb06967-d1d6-40ce-9026-14e256bca90d,,,,,,,,,,,,,,,,,,,,,,,,,,,0|i000pz:,,,,,,,,To Do,11/Jan/26 3:22 PM
Auto-scaling policies not configured for all production services; some workloads run fixed instance counts,FND-2,10348,Task,Not Started,FND,Findings,software,CPA to Cybersecurity,712020:aeb06967-d1d6-40ce-9026-14e256bca90d,,Medium,,,,CPA to Cybersecurity,712020:aeb06967-d1d6-40ce-9026-14e256bca90d,CPA to Cybersecurity,712020:aeb06967-d1d6-40ce-9026-14e256bca90d,11/Jan/26 3:21 PM,11/Jan/26 3:21 PM,,,,0,,,CPA to Cybersecurity,712020:aeb06967-d1d6-40ce-9026-14e256bca90d,,,,,,,,,,,,,,,,,,,,,,,,,,,0|i000pr:,,,,,,,,To Do,11/Jan/26 3:21 PM
Network monitoring lacks 24/7 coverage and external perimeter visibility,FND-1,10327,Task,Not Started,FND,Findings,software,CPA to Cybersecurity,712020:aeb06967-d1d6-40ce-9026-14e256bca90d,,Medium,,,,CPA to Cybersecurity,712020:aeb06967-d1d6-40ce-9026-14e256bca90d,CPA to Cybersecurity,712020:aeb06967-d1d6-40ce-9026-14e256bca90d,11/Jan/26 2:30 PM,11/Jan/26 3:26 PM,11/Jan/26 3:25 PM,,31/Aug/26 12:00 AM,0,"* Business impact includes extended threat actor dwell time increasing risk of customer biometric data breach (Security Goal 1), exposure of intellectual property (Security Goal 2), and potential negative impact on public trust score critical for an authentication company (Security Goal 4, Company Goal 3). 
* Recommendation is to accelerate Attack Surface Management deployment, evaluate managed detection and response providers to supplement Security Operations Center capacity, implement automated alert escalation in Amazon GuardDuty, and establish network traffic baselines for anomaly detection. ",,CPA to Cybersecurity,712020:aeb06967-d1d6-40ce-9026-14e256bca90d,,,,,,,,,,DE.CM-01,,,,,,,,,,,,,,,,,0|i000l3:,Remediation Owner: Nadia Khan,50% understaffing following departure of 5 key personnel in 2024 (Risk Register item 1) combined with delayed Attack Surface Management procurement. ,,,,,,To Do,11/Jan/26 2:30 PM
